<?xml version="1.0" encoding="UTF-8"?>
<xs:schema xmlns="http://www.uniovi.es" 
	elementFormDefault="qualified" 
	targetNamespace="http://www.uniovi.es"
	xmlns:xs="http://www.w3.org/2001/XMLSchema">
	<xs:element name="rutas">
		<xs:complexType>
			<xs:sequence>
				<xs:element minOccurs="1" maxOccurs="unbounded" ref="ruta" />
			</xs:sequence>
		</xs:complexType>
	</xs:element>
	<xs:element name="ruta">
		<xs:complexType>
			<xs:sequence>
				<xs:element ref="nombre" />
				<xs:element ref="tipo" />
				<xs:element ref="transporte" />
				<xs:element minOccurs="0" maxOccurs="1" ref="fechaInicio" />
				<xs:element minOccurs="0" maxOccurs="1" ref="horaInicio" />
				<xs:element ref="duracion" />
				<xs:element ref="agencia" />
				<xs:element ref="descripcion" />
				<xs:element ref="adecuadaPara" />
				<xs:element ref="inicio" />
				<xs:element ref="referencias" />
				<xs:element ref="recomendacion" />
				<xs:element ref="hitos" />
				<xs:element ref="planimetria" />
				<xs:element ref="altimetria" />
			</xs:sequence>
			<xs:attribute name="id" type="xs:ID" use="required" />
		</xs:complexType>
	</xs:element>
	<xs:element name="nombre" type="xs:string" />
	<xs:element name="tipo" type="xs:string" />
	<xs:element name="transporte" type="xs:string" />
	<xs:element name="fechaInicio" type="xs:date" />
	<xs:element name="horaInicio" type="xs:time" />
	<xs:element name="duracion" type="xs:string" />
	<xs:element name="agencia" type="xs:string" />
	<xs:element name="descripcion" type="xs:string" />
	<xs:element name="adecuadaPara" type="xs:string" />
	<xs:element name="inicio">
		<xs:complexType>
			<xs:sequence>
				<xs:element ref="lugar" />
				<xs:element ref="direccion" />
				<xs:element ref="coordenadas" />
			</xs:sequence>
		</xs:complexType>
	</xs:element>
	<xs:element name="lugar" type="xs:string" />
	<xs:element name="direccion" type="xs:string" />
	<xs:element name="coordenadas">
		<xs:complexType>
			<xs:sequence>
				<xs:element ref="longitud" />
				<xs:element ref="latitud" />
				<xs:element ref="altitud" />
			</xs:sequence>
		</xs:complexType>
	</xs:element>
	<xs:element name="longitud">
		<xs:simpleType>
			<xs:restriction base="xs:decimal">
				<xs:minInclusive value="-180" />
				<xs:maxInclusive value="180" />
			</xs:restriction>
		</xs:simpleType>
	</xs:element>
	<xs:element name="latitud">
		<xs:simpleType>
			<xs:restriction base="xs:decimal">
				<xs:minInclusive value="-90" />
				<xs:maxInclusive value="90" />
			</xs:restriction>
		</xs:simpleType>
	</xs:element>
	<xs:element name="altitud" type="xs:decimal" />
	<xs:element name="referencias">
		<xs:complexType>
			<xs:sequence>
				<xs:element minOccurs="3" maxOccurs="unbounded" ref="referencia" />
			</xs:sequence>
		</xs:complexType>
	</xs:element>
	<xs:element name="referencia">
		<xs:complexType>
			<xs:simpleContent>
				<xs:extension base="xs:string">
					<xs:attribute name="url" type="xs:anyURI" />
				</xs:extension>
			</xs:simpleContent>
		</xs:complexType>
	</xs:element>
	<xs:element name="recomendacion">
		<xs:simpleType>
			<xs:restriction base="xs:integer">
				<xs:minInclusive value="0" />
				<xs:maxInclusive value="10" />
			</xs:restriction>
		</xs:simpleType>
	</xs:element>
	<xs:element name="hitos">
		<xs:complexType>
			<xs:sequence>
				<xs:choice minOccurs="1" maxOccurs="unbounded">
					<xs:element ref="hito" />
					<xs:element ref="puntoRuta" />
				</xs:choice>
			</xs:sequence>
		</xs:complexType>
	</xs:element>
	<xs:element name="hito">
		<xs:complexType>
			<xs:sequence>
				<xs:element ref="nombre" />
				<xs:element ref="descripcion" />
				<xs:element ref="coordenadas" />
				<xs:element ref="distancia" />
				<xs:element ref="fotos" />
				<xs:element minOccurs="0" maxOccurs="1" ref="videos" />
			</xs:sequence>
			<xs:attribute name="id" type="xs:ID" use="required" />
		</xs:complexType>
	</xs:element>
	<xs:element name="puntoRuta">
		<xs:complexType>
			<xs:sequence>
				<xs:element ref="coordenadas" />
				<xs:element ref="distancia" />
			</xs:sequence>
			<xs:attribute name="seq" type="xs:positiveInteger" use="required" />
		</xs:complexType>
	</xs:element>
	<xs:element name="distancia">
		<xs:complexType>
			<xs:simpleContent>
				<xs:extension base="xs:decimal">
					<xs:attribute name="unidad" type="xs:string" use="required" />
				</xs:extension>
			</xs:simpleContent>
		</xs:complexType>
	</xs:element>
	<xs:element name="fotos">
		<xs:complexType>
			<xs:sequence>
				<xs:element minOccurs="1" maxOccurs="5" ref="foto" />
			</xs:sequence>
		</xs:complexType>
	</xs:element>
	<xs:element name="foto">
		<xs:complexType>
			<xs:attribute name="url" type="xs:anyURI" use="required" />
			<xs:attribute name="descripcion" type="xs:string" />
		</xs:complexType>
	</xs:element>
	<xs:element name="videos">
		<xs:complexType>
			<xs:sequence>
				<xs:element minOccurs="0" maxOccurs="3" ref="video" />
			</xs:sequence>
		</xs:complexType>
	</xs:element>
	<xs:element name="video">
		<xs:complexType>
			<xs:attribute name="url" type="xs:anyURI" use="required" />
			<xs:attribute name="descripcion" type="xs:string" />
		</xs:complexType>
	</xs:element>
	<xs:element name="planimetria" type="xs:string" />
	<xs:element name="altimetria" type="xs:string" />
</xs:schema>