<?xml version="1.0" encoding="UTF-8"?>
<rutas xmlns="http://www.uniovi.es"
       xmlns:xsi="http://www.w3.org/2001/XMLSchema-instance"
       xsi:schemaLocation="http://www.uniovi.es rutas.xsd">
    <ruta id="R01">
        <nombre>Ruta Monumental del Casco Histórico de Girona</nombre>
        <tipo>Arquitectura y monumentos</tipo>
        <transporte>A pie</transporte>
        <duracion>3 horas</duracion>
        <agencia>Sin agencia</agencia>

        <descripcion>
            Recorrido urbano por el casco histórico medieval de Girona. La ruta conecta 
            los monumentos más emblemáticos de la ciudad: el Pont Eiffel, la Catedral gótica, 
            el barrio judío (Call) y los Baños Árabes.
        </descripcion>

        <adecuadaPara>
            Se puede ir con niños. Tercera edad con precaución en tramos de subida.
        </adecuadaPara>

        <inicio>
            <lugar>Pont de les Peixateries Velles (Pont Eiffel)</lugar>
            <direccion>Rambla de la Llibertat</direccion>
            <coordenadas>
                <longitud>2.82388</longitud>
                <latitud>41.98457</latitud>
                <altitud>68</altitud>
            </coordenadas>
        </inicio>

        <referencias>
            <referencia url="https://www.girona.cat/turisme/esp/monuments.php">Ayuntamiento de Girona - Turismo: Monumentos de la ciudad histórica</referencia>
            <referencia url="https://es.wikipedia.org/wiki/Gerona">Wikipedia - Gerona: artículo general sobre la ciudad y su patrimonio</referencia>
            <referencia url="https://catalunyaturisme.cat/es/girona/">Catalunya Turisme - Qué hacer y qué ver en Girona</referencia>
        </referencias>

        <recomendacion>10</recomendacion>

        <hitos>
            <!-- HITO 1 -->
            <hito id="H01">
                <nombre>Pont de les Peixateries Velles (Pont Eiffel)</nombre>
                <descripcion>Puente metálico rojo construido en 1876. Conecta el Mercadal con la Rambla de la Lliberta.</descripcion>
                <coordenadas>
                    <longitud>2.82388</longitud>
                    <latitud>41.98457</latitud>
                    <altitud>68</altitud>
                </coordenadas>
                <distancia unidad="m">0</distancia>
                <fotos>
                    <foto url="./multimedia/ruta1/PontEiffel.jpg" descripcion="Vista general del puente rojo sobre el río Onyar"/>
                </fotos>
            </hito>
            
            <puntoRuta seq="1">
                <coordenadas>
                    <longitud>2.82430</longitud>
                    <latitud>41.98490</latitud>
                    <altitud>70</altitud>
                </coordenadas>
                <distancia unidad="m">50</distancia>
            </puntoRuta>

            <puntoRuta seq="2">
                <coordenadas>
                    <longitud>2.82485</longitud>
                    <latitud>41.98530</latitud>
                    <altitud>72</altitud>
                </coordenadas>
                <distancia unidad="m">55</distancia>
            </puntoRuta>

            <!-- HITO 2 -->
            <hito id="H02">
                <nombre>El Call Jueu (Barrio Judío)</nombre>
                <descripcion>Una de las juderías medievales mejor conservadas de Europa.</descripcion>
                <coordenadas>
                    <longitud>2.82520</longitud>
                    <latitud>41.98600</latitud>
                    <altitud>78</altitud>
                </coordenadas>
                <distancia unidad="m">120</distancia>
                <fotos>
                    <foto url="./multimedia/ruta1/CallJueu.jpg" descripcion="Callejuela típica del barrio judío."/>
                </fotos>
            </hito>
        
            <puntoRuta seq="3">
                <coordenadas>
                    <longitud>2.82555</longitud>
                    <latitud>41.98650</latitud>
                    <altitud>82</altitud>
                </coordenadas>
                <distancia unidad="m">60</distancia>
            </puntoRuta>

            <puntoRuta seq="4">
                <coordenadas>
                    <longitud>2.82590</longitud>
                    <latitud>41.98700</latitud>
                    <altitud>88</altitud>
                </coordenadas>
                <distancia unidad="m">65</distancia>
            </puntoRuta>

            <!-- HITO 3 -->
            <hito id="H03">
                <nombre>Catedral de Santa Maria de Girona</nombre>
                <descripcion>Templo construido entre los siglos XI y XVIII con elementos románicos, góticos y barrocos.</descripcion>
                <coordenadas>
                    <longitud>2.82631</longitud>
                    <latitud>41.98743</latitud>
                    <altitud>93</altitud>
                </coordenadas>
                <distancia unidad="m">80</distancia>
                <fotos>
                    <foto url="./multimedia/gerona-catedral.jpg" descripcion="Fachada barroca de la Catedral de Girona"/>
                    <foto url="./multimedia/ruta1/catedral-interior.jpg" descripcion="Interior de la nave gótica de la Catedral"/>
                </fotos>
            </hito>

            <puntoRuta seq="5">
                <coordenadas>
                    <longitud>2.82680</longitud>
                    <latitud>41.98770</latitud>
                    <altitud>90</altitud>
                </coordenadas>
                <distancia unidad="m">55</distancia>
            </puntoRuta>

            <hito id="H04">
                <nombre>Banys Àrabs (Baños Árabes)</nombre>
                <descripcion>Edificio románico de 1194. Es el conjunto de baños románicos mejor conservado de Cataluña.</descripcion>
                <coordenadas>
                    <longitud>2.82750</longitud>
                    <latitud>41.98830</latitud>
                    <altitud>86</altitud>
                </coordenadas>
                <distancia unidad="m">90</distancia>
                <fotos>
                    <foto url="./multimedia/ruta1/BanysArabs.jpg" descripcion="Interior de los baños árabes de Girona"/>
                </fotos>
            </hito>

            <puntoRuta seq="6">
                <coordenadas>
                    <longitud>2.82700</longitud>
                    <latitud>41.98790</latitud>
                    <altitud>84</altitud>
                </coordenadas>
                <distancia unidad="m">55</distancia>
            </puntoRuta>

            <puntoRuta seq="7">
                <coordenadas>
                    <longitud>2.82600</longitud>
                    <latitud>41.98720</latitud>
                    <altitud>80</altitud>
                </coordenadas>
                <distancia unidad="m">100</distancia>
            </puntoRuta>

            <puntoRuta seq="8">
                <coordenadas>
                    <longitud>2.82530</longitud>
                    <latitud>41.98680</latitud>
                    <altitud>76</altitud>
                </coordenadas>
                <distancia unidad="m">65</distancia>
            </puntoRuta>

            <!-- HITO 5 -->
            <hito id="H05">
                <nombre>Basílica de Sant Feliu</nombre>
                    <descripcion>Iglesia levantada entre los siglos XII y XVII sobre una necrópolis romana.</descripcion>
                <coordenadas>
                    <longitud>2.82480</longitud>
                    <latitud>41.98640</latitud>
                    <altitud>74</altitud>
                </coordenadas>
                <distancia unidad="m">70</distancia>
                <fotos>
                    <foto url="./multimedia/ruta1/basilica.jpg" descripcion="Fachada de la Basílica de Sant Feliu"/>
                </fotos>
            </hito>
        </hitos>
        <planimetria>planimetria_ruta1.kml</planimetria>
        <altimetria>altimetria_ruta1.svg</altimetria>
    </ruta>

    <ruta id="R02">
        <nombre>Camí de Ronda</nombre>
        <tipo>Senderismo litoral</tipo>
        <transporte>A pie</transporte>
        <fechaInicio>2025-06-15</fechaInicio>
        <horaInicio>08:30:00</horaInicio>
        <duracion>3 horas</duracion>
        <agencia>Sin agencia</agencia>

        <descripcion>
            Tramo del Camí de Ronda entre Calella de Palafrugell y Tamariu.
            Pasa por el faro de Sant Sebastià, uno de los miradores más altos de la Costa Brava.
        </descripcion>

        <adecuadaPara>
            Personas en buena forma física. No recomendable con niños pequeños por los tramos sin barandilla.
        </adecuadaPara>

        <inicio>
            <lugar>Platja de Canadell (Calella de Palafrugell)</lugar>
            <direccion>Passeig de Canadell</direccion>
            <coordenadas>
                <longitud>3.18450</longitud>
                <latitud>41.88900</latitud>
                <altitud>3</altitud>
            </coordenadas>
        </inicio>

        <referencias>
            <referencia url="https://www.camideronda.com/es/introduccio.html">Camí de Ronda oficial - Introducción y etapas</referencia>
            <referencia url="https://www.spain.info/es/rutas-senderismo/cami-ronda-costa-brava/">Spain.info - Cómo hacer el Camí de Ronda en Costa Brava</referencia>
            <referencia url="https://costabrava.org/es/blog/caminos-de-ronda-costa-brava/">Costa Brava Pirineu de Girona - Caminos de ronda</referencia>
        </referencias>

        <recomendacion>8</recomendacion>

        <hitos>
            <!-- HITO 1 -->
            <hito id="H06">
                <nombre>Calella de Palafrugell</nombre>
                <descripcion>Antiguo pueblo de pescadores con arcadas frente al mar y casas blancas.</descripcion>
                <coordenadas>
                    <longitud>3.18450</longitud>
                    <latitud>41.88900</latitud>
                    <altitud>3</altitud>
                </coordenadas>